{
  "contract": "gc_context_snapshot",
  "version": "v1",
  "snapshot_id": "gcs:gc:45",
  "primary_item_id": 45,
  "related_item_ids": [
    8,
    22,
    14
  ],
  "surface_summary": "Assess whether this remote workflow opportunity is ready to package for review.",
  "source_types": [
    "pasted_text",
    "pasted_text",
    "pasted_text",
    "pasted_text"
  ],
  "freshness": "recent",
  "known_gaps": [],
  "conflicting_item_ids": []
}